{
 "id": "geschichte-landesteilungen-linien-1240-1870",
 "title": {
  "de": "Landesteilungen und Linien des Hauses Weida–Reuß 1240–1870",
  "en": "Divisions of the land and lines of the house of Weida–Reuss, 1240–1870"
 },
 "category": "history",
 "section": "t1-5-3",
 "sources": [
  {
   "page": "333",
   "block": "b3"
  },
  {
   "page": "341",
   "block": "b4"
  },
  {
   "page": "355",
   "block": "b1"
  },
  {
   "page": "363",
   "block": "b1"
  },
  {
   "page": "374",
   "block": "b2"
  },
  {
   "page": "375",
   "block": "b1"
  },
  {
   "page": "375",
   "block": "b2"
  },
  {
   "page": "376",
   "block": "b1"
  },
  {
   "page": "376",
   "block": "b2"
  },
  {
   "page": "379",
   "block": "b2"
  },
  {
   "page": "380",
   "block": "b1"
  },
  {
   "page": "380",
   "block": "b2"
  },
  {
   "page": "381",
   "block": "b1"
  },
  {
   "page": "381",
   "block": "b2"
  },
  {
   "page": "382",
   "block": "b1"
  },
  {
   "page": "383",
   "block": "b2"
  },
  {
   "page": "385",
   "block": "b1"
  },
  {
   "page": "389",
   "block": "b4"
  },
  {
   "page": "390",
   "block": "b2"
  },
  {
   "page": "390",
   "block": "b3"
  },
  {
   "page": "390",
   "block": "b4"
  },
  {
   "page": "390",
   "block": "b5"
  },
  {
   "page": "391",
   "block": "b1"
  },
  {
   "page": "391",
   "block": "b2"
  },
  {
   "page": "403",
   "block": "b1"
  },
  {
   "page": "403",
   "block": "b2"
  },
  {
   "page": "403",
   "block": "b3"
  },
  {
   "page": "403",
   "block": "b4"
  },
  {
   "page": "403",
   "block": "b5"
  },
  {
   "page": "403",
   "block": "b6"
  }
 ],
 "summary": {
  "de": "Brückner beschreibt die Geschichte des Voigt- und Reußenhauses als Folge von Landesteilungen und Aussterben von Linien und fasst sie in Tab. XV (S. 403) sowie in einer Tabelle der älteren Linie (S. 390) zusammen. Der Datensatz erfasst 24 Linien und Häuser mit Anfangs- und Endjahr; die Diagramme zeigen ihre Lebensdauer und die Zahl der gleichzeitig regierenden Linien. Aus drei Linien um 1240 wurden bis 1694 zehn gleichzeitig regierende Häuser; die Wiedervereinigung erfolgte in der älteren Linie 1768, in der jüngeren 1848.",
  "en": "Brückner presents the history of the Voigt and Reuss house as a sequence of divisions of the land and extinctions of lines, summarised in Tab. XV (p. 403) and in a table for the older line (p. 390). The dataset records 24 lines and houses with their start and end years; the charts show their duration and the number of lines ruling at the same time. From three lines around 1240 the family grew to ten simultaneously ruling houses by 1694; the land was reunited in the older line in 1768 and in the younger line in 1848."
 },
 "method": {
  "de": "Jede Linie bzw. jedes Haus ist eine Zeile mit Anfangs- und Endjahr, entnommen aus Tab. XV (S. 403 b1–b6), der Tabelle der Häuser der älteren Linie (S. 390 b4) und dem Fließtext (S. 333, 355, 363, 374–376, 379–385, 389–391). Ungefähre Angaben (»um 1240«, »ca. 1305«, »ca. 1535«) stehen als Jahreszahl. Als Linie oder Haus zählt, was Brückner als eigene Herrschaft (Specialhaus, Zweig, Stammlinie) bezeichnet; die Paragiate Köstritz und die Nebenlinie Lobenstein-Selbitz sind nicht gezählt. Wo sich die Zusammensetzung mitten in einer Linie ändert, ist sie in Abschnitte zerlegt (z. B. Gera 1564–1647 ungeteilt, ab 1647 Specialhaus). Die Zahl der gleichzeitig bestehenden Linien (Datensätze »periods« und »yearly«) ist abgeleitet: Sie wurde aus den Zeilen berechnet; für 1625–1768 stimmt sie mit der gedruckten Tabelle auf S. 390 überein (4, 3, 2, 4, 5, 2, 1). Noch bestehende Linien sind bis 1870, dem Erscheinungsjahr, gezeichnet.",
  "en": "Each line or house is one row with its start and end year, taken from Tab. XV (p. 403 b1–b6), the table of the houses of the older line (p. 390 b4) and the running text (pp. 333, 355, 363, 374–376, 379–385, 389–391). Approximate statements (“c. 1240”, “c. 1305”, “c. 1535”) are entered as years. A line or house is whatever Brückner treats as a separate lordship (special house, branch, parent line); the appanages of Köstritz and the side line Lobenstein-Selbitz are not counted. Where the composition changes within a line it is split into periods (e.g. Gera undivided 1564–1647, special house from 1647). The number of simultaneously existing lines (datasets “periods” and “yearly”) is derived: it was computed from the rows; for 1625–1768 it agrees with the printed table on p. 390 (4, 3, 2, 4, 5, 2, 1). Lines that still exist are drawn up to 1870, the year of publication."
 },
 "findings": [
  {
   "de": "Aus drei Linien (Weida, Gera, Plauen) um 1240 wurden durch Teilungen bis 1694 insgesamt 10 gleichzeitig regierende Linien und Häuser: je 5 in der älteren und in der jüngeren Reuß-Linie (Höchststand 1694–1698; die jüngere Linie hatte schon 1678–1711 fünf).",
   "en": "Divisions turned the three lines (Weida, Gera, Plauen) of c. 1240 into as many as 10 simultaneously ruling lines and houses by 1694: 5 each in the older and the younger Reuss line (peak 1694–1698; the younger line already had five in 1678–1711)."
  },
  {
   "de": "Von den drei Voigt-Linien starben Weida (1240–1535, 295 Jahre), Gera (1240–1550, 310 Jahre) und der ältere Zweig von Plauen (1305–1572, 267 Jahre) aus; fortgeführt wurde nur der jüngere Zweig Reuß-Plauen, der 1564 in drei Linien geteilt wurde.",
   "en": "Of the three Voigt lines, Weida (1240–1535, 295 years), Gera (1240–1550, 310 years) and the older branch of Plauen (1305–1572, 267 years) died out; only the younger branch Reuss-Plauen continued, divided into three lines in 1564."
  },
  {
   "de": "Die ältere Linie war seit 1768 wieder in einer Hand, die jüngere erst seit 1848, also 80 Jahre später; die jüngere Linie blieb von 1564 bis 1647 (83 Jahre) ungeteilt, die ältere Linie bestand dagegen seit 1564 aus zwei, ab 1583 aus drei Häusern.",
   "en": "The older line was reunited in 1768, the younger one only in 1848, 80 years later; the younger line stayed undivided from 1564 to 1647 (83 years), whereas the older line consisted of two houses from 1564 and of three from 1583."
  },
  {
   "de": "Von den 17 Häusern und Zweigen der Reuß-Zeit (ab 1564), die vor 1870 endeten, bestand die Hälfte höchstens 32 Jahre (Median); am längsten hielten sich Ebersdorf (170), Gera (155), Lobenstein (146) und Untergreiz (143 Jahre).",
   "en": "Of the 17 houses and branches of the Reuss period (from 1564) that ended before 1870, half lasted at most 32 years (median); the longest-lived were Ebersdorf (170), Gera (155), Lobenstein (146) and Untergreiz (143 years)."
  }
 ],
 "caveats": [
  {
   "de": "Die Einteilung in Linien, Zweige und Häuser folgt Brückners Terminologie, ist aber nicht überall trennscharf (z. B. entstehen Burgk und Dölau zweimal); die Zählung gleichzeitiger Linien ist eine redaktionelle Ableitung.",
   "en": "The division into lines, branches and houses follows Brückner's terminology but is not sharp everywhere (e.g. Burgk and Dölau arise twice); the count of simultaneous lines is an editorial derivation."
  },
  {
   "de": "Ungefähre Jahreszahlen (um 1240, ca. 1305, ca. 1535) sind als Punktwerte eingetragen. Brückner nennt für Schleiz 204 Jahre, für Lobenstein 201 Jahre (S. 380, 383); bei gleichem Beginn 1647 und dem Ende 1848 ergeben sich für beide 201 Jahre, hier gilt daher 1647–1848 für beide.",
   "en": "Approximate years (c. 1240, c. 1305, c. 1535) are entered as point values. Brückner gives 204 years for Schleiz and 201 for Lobenstein (pp. 380, 383); with the same start in 1647 and an end in 1848 both come to 201 years, so 1647–1848 is used for both."
  },
  {
   "de": "Die Greizer Tabelle (S. 390) nennt 1667 und 1668 als Grenzjahre; das Jahr dazwischen bleibt, wie gedruckt, ohne Angabe.",
   "en": "The Greiz table (p. 390) gives 1667 and 1668 as boundary years; the year in between is left blank, as printed."
  }
 ],
 "datasets": [
  {
   "name": "houses",
   "title": {
    "de": "Linien und Häuser mit Anfangs- und Endjahr",
    "en": "Lines and houses with start and end year"
   },
   "columns": [
    {
     "name": "ord",
     "label": {
      "de": "Reihenfolge",
      "en": "Order"
     },
     "type": "integer",
     "unit": null,
     "derived": true
    },
    {
     "name": "branch",
     "label": {
      "de": "Zweig (Code)",
      "en": "Branch (code)"
     },
     "type": "string",
     "unit": null,
     "derived": true
    },
    {
     "name": "branch_de",
     "label": {
      "de": "Zweig",
      "en": "Branch"
     },
     "type": "string",
     "unit": null,
     "derived": true
    },
    {
     "name": "branch_en",
     "label": {
      "de": "Zweig (englisch)",
      "en": "Branch (English)"
     },
     "type": "string",
     "unit": null,
     "derived": true
    },
    {
     "name": "label_de",
     "label": {
      "de": "Linie/Haus",
      "en": "Line/house"
     },
     "type": "string",
     "unit": null
    },
    {
     "name": "label_en",
     "label": {
      "de": "Linie/Haus (englisch)",
      "en": "Line/house (English)"
     },
     "type": "string",
     "unit": null,
     "derived": true
    },
    {
     "name": "start_year",
     "label": {
      "de": "Beginn",
      "en": "Start"
     },
     "type": "integer",
     "unit": null
    },
    {
     "name": "end_year",
     "label": {
      "de": "Ende (leer = besteht fort)",
      "en": "End (empty = continues)"
     },
     "type": "integer",
     "unit": null
    },
    {
     "name": "end_plot",
     "label": {
      "de": "Ende für die Zeichnung",
      "en": "End for plotting"
     },
     "type": "integer",
     "unit": null,
     "derived": true,
     "note": "offene Linien bis 1870"
    },
    {
     "name": "event_de",
     "label": {
      "de": "Beginn und Ende (Brückner)",
      "en": "Start and end (Brückner)"
     },
     "type": "string",
     "unit": null
    },
    {
     "name": "event_en",
     "label": {
      "de": "Beginn und Ende (englisch)",
      "en": "Start and end (English)"